{
  "$schema": "https://json-schema.org/draft/2020-12/schema",
  "$id": "https://blockheads-club.github.io/mod-sdk/schema/index.schema.json",
  "title": "Blockheads signed mod index (index.json)",
  "description": "Built by the Blockheads-Club/mods CI from every entry file and signed with the index ed25519 key. The signature is a detached minisign file `index.json.minisig` next to `index.json`, made over the exact bytes of `index.json`; consumers (game, Patcher, website, server) ship the public key and must verify it before reading the file. Entries are sorted by id, versions in publication order.",
  "type": "object",
  "additionalProperties": false,
  "required": ["schema", "generated", "api", "mods"],
  "properties": {
    "schema": { "const": 1 },
    "generated": { "type": "string", "pattern": "^\\d{4}-\\d{2}-\\d{2}T\\d{2}:\\d{2}:\\d{2}Z$", "description": "UTC build time." },
    "api": {
      "type": "array",
      "minItems": 1,
      "description": "blockheads:api versions the index CI checked against.",
      "items": { "$ref": "mod.schema.json#/$defs/semver" }
    },
    "mods": {
      "type": "array",
      "items": {
        "allOf": [
          { "$ref": "index-entry.schema.json" },
          { "properties": { "versions": { "items": { "required": ["size"] } } } }
        ]
      }
    }
  }
}
