{
  "schema": 1,
  "generated": "2026-11-20T12:00:00Z",
  "api": ["0.1.0"],
  "mods": [
    {
      "id": "hello-lua",
      "name": "Hello (Lua)",
      "owners": ["Blockheads-Club"],
      "repo": "https://github.com/Blockheads-Club/mod-sdk",
      "versions": [
        {
          "version": "0.1.0",
          "url": "https://github.com/Blockheads-Club/mod-sdk/releases/download/v0.1.0/hello-lua-0.1.0.bhmod",
          "sha256": "9b1c6f0d2e3a4b5c6d7e8f90a1b2c3d4e5f60718293a4b5c6d7e8f9012345678",
          "size": 1532,
          "sides": ["server"],
          "api": "^0.1",
          "permissions": { "players": ["chat"] },
          "published": "2026-11-20"
        }
      ]
    }
  ]
}
